{
    "$schema": "http://json-schema.org/draft-04/schema#",
    "id": "http://justice.gov.uk/core/courts/search/external/apiProsecutionCaseSummary.json",
    "description": "A summary of a prosecution case",
    "type": "object",
    "properties": {
        "prosecutionCaseId": {
            "$ref": "http://justice.gov.uk/core/courts/external/apiCourtsDefinitions.json#/definitions/uuid"
        },
        "prosecutionCaseReference": {
            "description": "The prosecuting authorities reference for their prosecution case that is layed before court.  For example PTI-URN from police/cps cases",
            "type": "string"
        },
        "caseStatus": {
            "description": "The status of the case.  When SJP Referrals are received or when court proceedings are initialised this will be set to ACTIVE by the receiving Progression API",
            "$ref": "http://justice.gov.uk/core/courts/external/apiCourtsDefinitions.json#/definitions/prosecutionCaseStatus"
        },
        "defendantSummary": {
            "description": "The defendants accused on the prosecution case",
            "type": "array",
            "minItems": 1,
            "items": {
                "$ref": "http://justice.gov.uk/core/courts/search/external/apiDefendantSummary.json"
            }
        },
        "hearingSummary": {
            "description": "The court proceedings for the prosecution case",
            "type": "array",
            "minItems": 1,
            "items": {
                "$ref": "http://justice.gov.uk/core/courts/search/external/apiHearingSummary.json"
            }
        }
    },
    "required": [
        "prosecutionCaseId",
        "prosecutionCaseReference",
        "caseStatus",
        "defendantSummary"
    ],
    "additionalProperties": false
}