{
  "caseStatus": "ACTIVE",
  "prosecutionCaseId": "46def95e-3088-4e8c-b7c9-83b2208f7800",
  "prosecutionCaseReference": "30DI0570888",
  "defendantSummary": [
    {
      "proceedingsConcluded": false,
      "defendantId": "b760daba-0d38-4bae-ad57-fbfd8419aefe",
      "defendantASN": "2100000000000267128K",
      "defendantName": "Bob Steven Smith",
      "defendantDOB": "1986-11-10",
      "defendantNINO": "AA123456C",
      "offenceSummary": [
        {
          "offenceId": "9aca847f-da4e-444b-8f5a-2ce7d776ab75",
          "offenceCode": "TH68026C",
          "offenceTitle": "Conspire to commit a burglary dwelling with intent to steal",
          "offenceLegislation": "Contrary to section 1(1) of the    Criminal Law Act 1977.",
          "proceedingsConcluded": false,
          "arrestDate": "2021-03-23",
          "startDate": "2021-03-06",
          "chargeDate": "2021-03-24",
          "modeOfTrial": "Indictable",
          "orderIndex": 1,
          "wording": "In the county of DERBYSHIRE, conspired together with John Doe to enter as a trespasser",
          "laaApplnReference": {
            "statusId": "18e86937-9652-32a3-a9fb-dbd01eda86a5",
            "statusCode": "GR",
            "statusDescription": "Granted (One Advocate)",
            "statusDate": "2021-05-02",
            "applicationReference": "6960540"
          }
        },
        {
          "offenceId": "4a852bd1-0068-422c-994f-78a5373ecd75",
          "offenceCode": "CJ88149",
          "offenceTitle": "Assault by beating of an emergency worker",
          "offenceLegislation": "Contrary to section 39 of the Criminal Justice Act 1988 and section 1 of the Assaults on Emergency Workers (Offences) Act 2018.",
          "proceedingsConcluded": false,
          "arrestDate": "2021-03-23",
          "startDate": "2021-03-23",
          "chargeDate": "2021-03-24",
          "modeOfTrial": "Either Way",
          "orderIndex": 2,
          "wording": "On 23.05.2021 at DERBY in the county of DERBYSHIRE assaulted an emergency worker, namely Police Constable",
          "laaApplnReference": {
            "statusId": "18e86937-9652-32a3-a9fb-dbd01eda86a5",
            "statusCode": "GR",
            "statusDescription": "Granted (One Advocate)",
            "statusDate": "2021-05-02",
            "applicationReference": "6960540"
          }
        }
      ]
    },
    {
      "proceedingsConcluded": false,
      "defendantId": "562dc2de-2258-4476-8be4-69cf15623f83",
      "defendantASN": "2100000000000266764M",
      "defendantName": "John Doe",
      "defendantDOB": "1992-07-27",
      "offenceSummary": [
        {
          "offenceId": "a6437f6a-bdac-44ca-898a-486bdacc9625",
          "offenceCode": "TH68026C",
          "offenceTitle": "Conspire to commit a burglary dwelling with intent to steal",
          "offenceLegislation": "Contrary to section 1(1) of the Criminal Law Act 1977.",
          "proceedingsConcluded": false,
          "arrestDate": "2021-03-23",
          "startDate": "2021-03-06",
          "chargeDate": "2021-03-24",
          "modeOfTrial": "Indictable",
          "orderIndex": 1,
          "wording": "Between 06.03.2021 and 22.03.2021 at DERBY in the county of DERBYSHIRE, conspired together with Harry Potter to enter as a trespasser, a number of dwellings within the CHADDESDEN and LITTLEOVER areas of DERBY, with intent to steal therein\n'Contrary to section 1(1) of the Criminal Law Act 1977.'\n -- CCCJS CODE: 'TH68026C'",
          "laaApplnReference": {
            "applicationReference": "6960540",
            "statusId": "98e86937-9652-32a3-a9fb-dbd01eda86a5",
            "statusCode": "GR",
            "statusDescription": "Granted (One Advocate)",
            "statusDate": "2021-05-02"
          }
        }
      ]
    }
  ]
}
